{
  "schema_version": 1,
  "generator_version": "0.1.0",
  "input_sha256": "8c9cf417cba7f627aaaa6b38cab91c78f0546cef781e95ae11ff378cc9a597de",
  "files": [
    {
      "path": ".codex/team-service/project-profile.json",
      "sha256": "ffd28718f55a2598f69a359ff8ed2395ad9e7146ebf68d8dbfc26a5af550eec5",
      "mode": "TRACKED_PROJECT",
      "classification": "CREATE"
    },
    {
      "path": ".codex/team-service/capability-policy.json",
      "sha256": "ea031bc0f913781f9a45a09d5bc602cea188a6d307ef9d3700bf10f89fd4bcaf",
      "mode": "TRACKED_PROJECT",
      "classification": "CREATE"
    },
    {
      "path": ".codex/team-service/README.md",
      "sha256": "dc44f259654b526d3341b46abbfd5b8891f2007e7d8f7f68a71ebe0c12b6b00e",
      "mode": "TRACKED_PROJECT",
      "classification": "CREATE"
    },
    {
      "path": ".codex/team-service/gitattributes.fragment",
      "sha256": "43d99f0d470e3acaa443d0212d216b3929395f64e5fb496ac3424ad6248b4184",
      "mode": "TRACKED_PROJECT",
      "classification": "CREATE"
    },
    {
      "path": ".codex/team-service/gitignore.fragment",
      "sha256": "d43bf1690365669ee7415ba0807b9c03a47857673939a9061175464db96ba129",
      "mode": "TRACKED_PROJECT",
      "classification": "CREATE"
    },
    {
      "path": ".codex/team-service/chats/MASTER-01-HUMAN-DECISIONS.json",
      "sha256": "067915c51a91596134e42ee982fe52ea64725d04f6f7bd5e1a0b9df76a58bb57",
      "mode": "TRACKED_PROJECT",
      "classification": "CREATE"
    },
    {
      "path": ".codex/team-service/chats/MASTER-02-ORCHESTRATION.json",
      "sha256": "ecf70893e182efc2b994f7b2f2bfcb8abe07047d1dc23f65083039b19dbcf1f7",
      "mode": "TRACKED_PROJECT",
      "classification": "CREATE"
    },
    {
      "path": ".codex/team-service/chats/MASTER-03-DEPUTY-CONTEXT.json",
      "sha256": "8e89cce5fe39e2b5844c229a9a24d69a81d32736ff263f01a99ab72fc6d8ca14",
      "mode": "TRACKED_PROJECT",
      "classification": "CREATE"
    },
    {
      "path": ".codex/team-service/chats/MASTER-04-DEVELOPMENT-STAGING.json",
      "sha256": "def57a13f9ea86ac91dc4bc4773710f7044fdeef970769f2216251ab876721cf",
      "mode": "TRACKED_PROJECT",
      "classification": "CREATE"
    },
    {
      "path": ".codex/team-service/chats/MASTER-05-PRODUCTION-RECOVERY.json",
      "sha256": "af05495f2d251bb0e936f62220ef0d990e95f673a8311ecdb43901f2e28a255e",
      "mode": "TRACKED_PROJECT",
      "classification": "CREATE"
    },
    {
      "path": ".codex/team-service/chats/DEPARTMENT-00-ALL-TEAMS-ROOM.json",
      "sha256": "47a0761b6095b3ef389117d46afef9e4ae3dce84871208634b519c59c2a7178e",
      "mode": "TRACKED_PROJECT",
      "classification": "CREATE"
    },
    {
      "path": ".codex/team-service/chats/DEPARTMENT-01-PRODUCT-MOBILE.json",
      "sha256": "1d7493d465a0dab8af2524c0c44b8b7c14662c67b1f70698a16d702f3c25b7b2",
      "mode": "TRACKED_PROJECT",
      "classification": "CREATE"
    },
    {
      "path": ".codex/team-service/chats/DEPARTMENT-02-DATA-BACKEND.json",
      "sha256": "337bcc6a3c9f154db7702a3dbb9dfb2f8175c948a0b95d72dc43a608216199bd",
      "mode": "TRACKED_PROJECT",
      "classification": "CREATE"
    },
    {
      "path": ".codex/team-service/chats/DEPARTMENT-03-SERVER-OPERATIONS.json",
      "sha256": "795613e586c1b06ebb191a8c02cf002491b150a63a556c94eb415d4b5a50c56c",
      "mode": "TRACKED_PROJECT",
      "classification": "CREATE"
    },
    {
      "path": ".codex/team-service/chats/DEPARTMENT-04-QUALITY-REVIEW.json",
      "sha256": "c0cf8b1003c71c0d80e9d6e575d040f251b21698bee6288c468939015b1645ee",
      "mode": "TRACKED_PROJECT",
      "classification": "CREATE"
    },
    {
      "path": ".codex/team-service/chats/DEPARTMENT-05-KNOWLEDGE-ORCHESTRATION.json",
      "sha256": "8c1a84abfef0cd7657036c3d78959ca37af494f7a23ce3ff69a518a3da355a69",
      "mode": "TRACKED_PROJECT",
      "classification": "CREATE"
    }
  ]
}
